{
  "version": "1.0.0",
  "title": "wmti walks itself",
  "description": "A guided tour of the wmti viewer's own architecture: a pure core wrapped in a thin Neovim shell. Read top to bottom to see how a :WmtiOpen turns a JSON file into a stepped, drift-tolerant tour.",
  "base_sha": "525135e",
  "steps": [
    {
      "file": "plugin/wmti.lua",
      "line_start": 7,
      "line_end": 17,
      "anchor": "local function cmd(name, fn)",
      "title": "Commands are the only entry point",
      "why": "The plugin ships no default keymaps — it exposes itself purely through :Wmti* commands so it never clobbers your bindings. Each command thunks into require('wmti'), which is what lets lazy.nvim defer loading until you actually run one."
    },
    {
      "file": "lua/wmti/init.lua",
      "line_start": 11,
      "line_end": 23,
      "anchor": "function M.open()",
      "title": "Open flow: notify, auto, or pick",
      "why": "The open decision lives here, not in the UI: zero walkthroughs notify, exactly one auto-opens (no wasted keystroke), many fall through to the picker. :WmtiSelect reuses select() to always re-prompt."
    },
    {
      "file": "lua/wmti/walkthrough.lua",
      "line_start": 8,
      "line_end": 21,
      "anchor": "function M.discover(root)",
      "title": "The filesystem boundary",
      "why": "All disk access for walkthroughs is funneled through this module: glob .wmti/*.json, read bytes, hand the string to core.load. Keeping I/O here is what lets core stay pure and testable without touching a real file."
    },
    {
      "file": "lua/wmti/core.lua",
      "line_start": 44,
      "line_end": 63,
      "anchor": "function M.resolve(step, lines)",
      "title": "The heart: drift-tolerant resolve",
      "why": "This is why the viewer survives code moving after authoring. It matches the step's anchor text against the current buffer (exact, then whitespace-trimmed), picks the occurrence nearest the recorded line, and re-spans — falling back to the raw line with a 'moved' flag when the anchor is gone. Pure function, no Neovim."
    },
    {
      "file": "lua/wmti/nav.lua",
      "line_start": 45,
      "line_end": 79,
      "anchor": "function M.goto_step(index)",
      "title": "Wiring core into windows",
      "why": "goto_step is the seam between pure logic and the editor: it loads the file into the code window, feeds its lines to core.resolve, then centers and highlights the result — and deliberately returns focus to the sidebar so you can keep stepping (sidebar-driven preview)."
    },
    {
      "file": "lua/wmti/sidebar.lua",
      "line_start": 64,
      "line_end": 80,
      "anchor": "function M.render(s, resolved)",
      "title": "What you actually read",
      "why": "The sidebar shows every step's title but the full 'why' for the current step only, plus its resolved location and any 'may have moved' / 'file missing' flag. Re-rendering from scratch each step keeps the panel a dumb projection of session state."
    },
    {
      "file": "tests/core_spec.lua",
      "line_start": 40,
      "line_end": 45,
      "anchor": "h.test(\"resolve relocates to the exact anchor when lines have drifted\", function()",
      "title": "Proof the drift handling works",
      "why": "core is the single tested seam. This spec injects a lines table where the anchored code has shifted down and asserts resolve relocates to it — exercising the exact behavior step 4 promises, with zero Neovim, git, or real files involved."
    }
  ]
}
